"node","x","y","z"
"Impact of Education Environments",0.058493686710453,0.096269067175051,1.67100521784171
"Impact of Light on Environment and Health",0.676578542664147,1.41599939724602,0.799556564638398
"Impact of Technology on Adolescents",1.2646201043271,-0.395332229796936,1.88654930190137
"Impulse Buying and Technology Impacts",-0.762240465362519,1.13715152806898,1.87702193404193
"Inclusion and Disability in Education and Sport",1.38317452581004,-0.973442902659565,1.17968204271797
"Inclusive Education and Diversity",-0.591724383509632,-2.67466051711596,1.87946583158877
"Income, Poverty, and Inequality",0.536101846332696,0.0122516561015009,2.51786104739816
"Indian and Buddhist Studies",-0.504362919008241,-0.550317509769462,2.34586705280568
"Indian Economic and Social Development",0.0356898619007317,-0.00943616160992378,2.73912109341926
"Indian History and Philosophy",-0.0587653088152923,-0.554494688515825,3.08488622228188
"Indigenous and Place-Based Education",0.983541758536313,-0.669898027762503,1.6617074733559
"Indigenous Cultures and History",-1.05707662685589,-2.34221302714404,2.06753624284232
"Indigenous Cultures and Socio-Education",-1.01722436453507,-2.43413500949003,2.08603775212763
"Indigenous Health and Education",-0.90426650049284,-1.8728976552264,1.16754586360413
"Indigenous Health, Education, and Rights",-0.825933649378044,-0.527955080552937,0.739813580144979
"Indigenous Knowledge Systems and Agriculture",-1.03194875432292,-0.484565270975469,0.584218189448171
"Indigenous Peoples' Rights and Law",-0.785190318984682,-0.0503943566888955,2.52010523504194
"Indigenous Studies and Ecology",-1.15998027300963,-0.408695502712512,0.372578080444051
"Indigenous Studies in Latin America",-0.925999746357378,-1.7934064391821,1.38152014562358
"Indonesian Election Politics and Participation",-1.63376074084794,0.29129223135287,1.19526329306688
"Indonesian Legal and Regulatory Studies",-1.6303388814242,0.227313399421218,1.02233989400262
"Indoor Air Quality and Microbial Exposure",-0.114189648808687,-0.669845006720853,-0.928223418990679
"Indoor and Outdoor Localization Technologies",1.02048003416656,2.31914912985323,-0.00938196804597347
"Induction Heating and Inverter Technology",0.254906165870608,2.32073611095737,0.0360332198978881
"Industrial and Mining Safety",-0.14272054179786,1.65101379353782,0.22633423830994
"Industrial Automation and Control Systems",0.219627996380317,1.68955304913173,0.368202439817675
"Industrial Engineering and Technologies",-0.546375981647057,2.14254677733857,-0.449174919387906
"Industrial Gas Emission Control",-0.542748291292479,1.54865189514965,-2.11574688063574
"Industrial Technology and Control Systems",0.215716069948698,1.54968788834397,0.31947022014618
"Industrial Vision Systems and Defect Detection",0.547918855270798,2.13947201924481,-0.698983185296106
"Inertial Sensor and Navigation",0.724688529630353,1.93732716670366,-0.338625053176328
"Infant Development and Preterm Care",0.924673016451967,-1.53513289960858,-0.710139489690664
"Infant Health and Development",0.402503349732261,-1.63348625285419,-1.10670646318052
"Infant Nutrition and Health",0.451973531075491,-1.66264620920804,-0.976318440493106
"Infection Control and Ventilation",-0.127883373183445,-0.910780483684342,-0.795603873163595
"Infection Control in Healthcare",-0.119134793949649,-1.06445549516885,-0.809936770327527
"Infections and bacterial resistance",-0.494742471188129,-1.38886197547149,-1.5735344420408
"Infectious Aortic and Vascular Conditions",0.849566954640738,-2.08308742039081,-1.72858626302342
"Infectious Disease Case Reports and Treatments",0.552455435374343,-2.32662901278588,-1.37827993969843
"Infectious Diseases and Mycology",-0.475893288551938,-1.82612431001727,-1.70454104836769
"Infectious Diseases and Tuberculosis",0.297560571518552,-1.82130023832843,-1.1052995254735
"Infectious Encephalopathies and Encephalitis",-0.123462127059503,-1.3288384019822,-1.69903768210333
"Infective Endocarditis Diagnosis and Management",-0.256954307013126,-1.50942283409875,-1.52054703035457
"Inflammasome and immune disorders",0.309867089692772,-1.45715063475726,-1.95365187995294
"Inflammation biomarkers and pathways",0.393122873420664,-1.27692045718705,-2.07026276840253
"Inflammatory Biomarkers in Disease Prognosis",0.475256046737236,-1.51096320017232,-1.79910480606113
"Inflammatory Bowel Disease",0.116827763647459,-1.84501887700744,-1.69395309759802
"Inflammatory mediators and NSAID effects",0.350493200897373,-0.763408923254286,-2.25941807219318
"Inflammatory Myopathies and Dermatomyositis",0.394780657770923,-1.98683652920071,-1.94404252773496
"Influenza Virus Research Studies",-0.563400830175762,-1.20663307168664,-1.51661746765751
"Information and Cyber Security",1.33482967571143,1.66215899919736,1.01716404085461
"Information Architecture and Usability",-0.669226561304084,-1.18122908953647,0.805600544615077
"Information Retrieval and Data Mining",-1.41176233124224,0.725509669654399,0.887512963085769
"Information Retrieval and Search Behavior",1.19054938041643,0.717009015973465,1.14052596440056
"Information Science and Libraries",-0.83042441437205,-1.7022951580229,0.976924495665128
"Information Society and Technology Trends",0.209478667522512,0.0945033657096774,1.77780034997279
"Information Systems and Technology Applications",-0.0155182969634012,1.59496383630722,0.679552501424132
"Information Systems Education and Curriculum Development",0.898589395846492,0.134152819238937,1.63419291170793
"Information Systems Theories and Implementation",1.11452609892977,0.775832958690932,1.83780029814201
"Information Technology and Learning",-0.915984495718142,-1.24354515928309,2.56495806432
"Information Technology Governance and Strategy",1.09689069051341,1.0618096706154,1.68697804360089
"Infrared Target Detection Methodologies",0.676772373559288,2.30780516198734,-1.08942434720161
"Infrared Thermography in Medicine",0.7533518217384,-0.763323456928701,-0.981443923279748
"Infrastructure Maintenance and Monitoring",-0.617971297383302,1.82206935599855,-0.312485540544283
"Infrastructure Resilience and Vulnerability Analysis",0.042630978576324,1.17943323447003,0.686912662957886
"Inhalation and Respiratory Drug Delivery",0.0887404324537826,-1.51685938274736,-1.33013968916761
"Injection Molding Process and Properties",-0.452559989358469,2.00703793779859,-1.04881682728974
"Injury Epidemiology and Prevention",0.807959836113048,-1.13015151873354,-0.567515931315565
"Innovation and Knowledge Management",0.755705737955568,0.784992365400469,2.22797748185953
"Innovation and Socioeconomic Development",0.562752155549788,0.771411625193153,2.4174065607824
"Innovation Diffusion and Forecasting",0.674572242594554,0.990315685664445,2.2087520972482
"Innovation in Digital Healthcare Systems",0.514896080353433,1.05459587053017,0.509785688973016
"Innovation Policy and R&D",0.51344711363904,0.723996632656225,2.25272129378652
"Innovation, Sustainability, Human-Machine Systems",0.731939137911432,0.590558447242747,1.72980707685044
"Innovation, Technology, and Society",0.362344286490427,-0.518463435810965,1.01620217063288
"Innovations and Analysis in Business and Education",0.552360561924299,0.352751838008728,2.07219995869661
"Innovations in Aquaponics and Hydroponics Systems",-1.59888493938529,0.641381569684561,-1.67694380066984
"Innovations in Concrete and Construction Materials",-0.742336740096978,1.75841597049619,-0.758428571339506
"Innovations in Education and Learning Technologies",-0.134299472311153,0.733616661017467,1.58749701521102
"Innovations in Educational Methods",1.24620025439538,-0.216327650609821,1.98761611454343
"Innovations in Medical Education",1.09207524219901,-1.33246565454783,0.527154047987973
"Innovative Approaches in Technology and Social Development",1.08065036799337,0.755824552441512,1.87179484905653
"Innovative concrete reinforcement materials",-0.784158732619869,1.83620255356584,-0.751809979433847
"Innovative Education and Learning Practices",1.17625007593671,-0.648275649790013,1.85939953643463
"Innovative Education Methods and Tools",-0.981618956249749,0.169601497914272,0.999059730914316
"Innovative Educational Techniques",0.365672530525818,0.541892665460163,0.917320986797383
"Innovative Educational Technologies",-0.129032956177204,0.713383343246901,1.51639045970427
"Innovative Energy Harvesting Technologies",0.563793276733655,2.1372524877376,-0.414579947832489
"Innovative Human-Technology Interaction",1.23830115615142,0.713652173142277,1.54644048943183
"Innovative Microfluidic and Catalytic Techniques Innovation",-0.120005822955607,0.742021176742128,-1.87685912830496
"Innovative Teaching and Learning Methods",1.33155545865811,-0.105794458817285,1.51292936287987
"Innovative Teaching Methodologies in Social Sciences",0.904504653737433,-0.642872822073273,2.23218770695716
"Innovative Teaching Methods",1.28948605034862,-0.151756797089112,1.51091997161526
"Inorganic and Organometallic Chemistry",0.0996402064393244,1.21240601836378,-2.53346448698965
"Inorganic Chemistry and Materials",0.188606642001365,2.03122446550099,-2.33979751202411
"Inorganic Fluorides and Related Compounds",0.288197862783376,1.76219506894067,-2.4603754853173
"Insect and Arachnid Ecology and Behavior",-1.82923222095121,-0.539548325486286,-1.559565529772
"Insect and Pesticide Research",-1.83944663831478,-0.552314474177892,-1.63214829100272
"Insect behavior and control techniques",-1.97294711883524,-0.574697379310843,-1.59134147054876
"Insect Pest Control Strategies",-1.83555961240996,-0.59968332468356,-1.70317543353177
"Insect Pheromone Research and Control",-1.98987239757369,-0.456265367338441,-1.55249284861701
"Insect Resistance and Genetics",-1.71595189509377,-0.673402559634816,-1.80953954334647
"Insect symbiosis and bacterial influences",-1.55455443932437,-0.784370307400854,-1.7657658401546
"Insect Utilization and Effects",-1.69462788569279,-0.536227697617375,-1.64936177109113
"Insect-Plant Interactions and Control",-2.02519700186121,-0.547301387147495,-1.59429583801261
"Insects and Parasite Interactions",-1.61423403165784,-0.787556864278866,-1.41624003091388
"Insurance and Financial Risk Management",0.651276616050767,1.10847286230166,2.36538408387197
"Insurance, Mortality, Demography, Risk Management",0.742033758847666,1.17060983041161,2.22576395648539
"Integrated Circuits and Semiconductor Failure Analysis",0.691386827750202,2.43210804283379,-0.810365152953392
"Integrated Energy Systems Optimization",-0.0752335037548241,1.9166949642832,0.827154768399151
"Integrated Water Resources Management",-0.923696428192195,0.958170048085007,0.363257543168726
"Intellectual Capital and Performance Analysis",0.799008116776824,0.789595183804457,2.1764330991233
"Intellectual Property and Patents",0.454237692798062,0.150891114540363,1.54290209628345
"Intellectual Property Law",0.0412930342880209,0.043530707459843,1.61250363427758
"Intellectual Property Rights and Media",-0.567174232040549,0.444204971636853,2.1173437209501
"Intelligence, Security, War Strategy",0.46606922375146,0.755783933050546,1.43021331495085
"Intelligent Tutoring Systems and Adaptive Learning",1.30010292036753,0.115089904115675,1.48571032783891
"Intensive Care Unit Cognitive Disorders",0.989090555018209,-1.48474874928748,-0.816738746448324
"Interactive and Immersive Displays",1.03972209727189,1.12803422477535,0.418592736833581
"Interconnection Networks and Systems",1.47411767676255,2.34606453404533,0.058800155259001
"Interdisciplinary Cultural and Social Studies",-0.429423509342317,-0.591777789027288,0.983047114901203
"Interdisciplinary Research and Collaboration",0.694838342554468,-0.127940310568009,1.50594154722469
"Interdisciplinary Studies and Sociocultural Dynamics",0.118559288531144,-0.229264005377078,1.26299640241416
"Interdisciplinary Studies: Technology, Society, and Humanities",0.0823440076230023,-0.548354294779043,1.84986164091701
"interferon and immune responses",-0.137001585153887,-1.15645466383287,-2.28394357220518
"Intergenerational and Educational Inequality Studies",0.906599857863432,-0.332729725514797,2.43388062873294
"Intergenerational Family Dynamics and Caregiving",1.38147060629905,-1.29109833775511,0.871045567721393
"Intermetallics and Advanced Alloy Properties",-0.111743806737704,2.44511201584193,-1.5923125724116
"International Arbitration and Investment Law",-0.453020156308432,0.509853801142839,2.56733919710031
"International Business and FDI",0.258809354901443,0.731649495222375,2.60978962815365
"International Development and Aid",-0.194552635774056,0.246353780510499,2.7273397869009
"International Environmental Law and Policies",-0.592101092400393,0.366162728461053,2.46744927141716
"International Human Rights and Reproductive Law",-0.724664511934734,0.131061732512341,2.52726425679877
"International Labor and Employment Law",-0.593119029517108,0.147330625691184,2.6064219099108
"International Law and Aviation",-0.561353763368555,0.383623200497272,2.63925282442032
"International Law and Human Rights",-0.547182423471022,0.260537054320273,2.7217086473882
"International Maritime Law Issues",-0.692347169189707,1.01085443644351,1.53619963851856
"International Relations and Autism",-0.793893262185185,-1.86583184435445,1.16769785348023
"International Relations and Foreign Policy",-0.411738890903512,0.158666718384324,2.60863825028091
"International Relations in Latin America",-1.08838656498475,-2.19168900308289,1.91259745037927
"International Science and Diplomacy",0.214345327966623,0.0531225620966831,1.36429022595533
"International Student and Expatriate Challenges",1.22227366457253,-0.468871432719115,2.18640368509834
"Internet of Things and AI",0.568185527566703,1.09308445512722,0.379099814532677
"Internet of Things and Social Network Interactions",0.335990441600594,1.33063558633481,0.468251401760299
"Internet Traffic Analysis and Secure E-voting",1.50104519243543,1.82271027497893,0.75853221980302
"Interpreting and Communication in Healthcare",1.87648173767359,-0.317982824142496,1.71927004592646
"Interprofessional Education and Collaboration",1.12806322017206,-1.33563959062842,0.76068854870248
"Interstitial Lung Diseases and Idiopathic Pulmonary Fibrosis",0.488887063034781,-2.11242534238333,-1.74832031729619
"Intestinal and Peritoneal Adhesions",0.557134970462302,-2.31404829035504,-1.22946470470835
"Intestinal Malrotation and Obstruction Disorders",0.505413078597037,-2.35703676494307,-1.28629000462703
"Intimate Partner and Family Violence",1.19610973439112,-1.46010996406552,1.54455736698781
"Intracerebral and Subarachnoid Hemorrhage Research",1.36339906015844,-1.33207412188501,-1.50781311095478
"Intracranial Aneurysms: Treatment and Complications",1.42035907689761,-1.2973392388105,-1.53187260352294
"Intramuscular injections and effects",0.288718885723882,-1.61148801285008,-1.24763401834984
"Intraocular Surgery and Lenses",0.327672072161046,-0.978496801348138,-1.63055014400824
"Intraoperative Neuromonitoring and Anesthetic Effects",-0.0713372015931357,-0.812694142117281,-0.256812779588681
"Intraperitoneal and Appendiceal Malignancies",0.559815233640641,-2.50832939777135,-1.30098509497894
"Intravenous Infusion Technology and Safety",0.373496690832343,0.567730500661944,0.0317180128210823
"Intuitionistic Fuzzy Systems Applications",0.203641736101473,1.28992427402914,0.960645956011868
"Invertebrate Immune Response Mechanisms",-1.52503324347521,-0.636723534121513,-1.66444624669739
"Invertebrate Taxonomy and Ecology",-1.77563621545197,-0.447883777358227,-1.21845979533293
"Ion channel regulation and function",0.48512526488963,-0.816918704688269,-2.07716956325624
"Ion Channels and Receptors",0.173849316621731,-0.755305009079266,-2.14069908953263
"Ion Transport and Channel Regulation",0.73999066403454,-1.23610962444422,-2.12664873948981
"Ion-surface interactions and analysis",0.345536159651681,2.10218643298767,-1.79058655989582
"Ionic liquids properties and applications",-0.158353727256479,1.55575741387664,-2.16354535293912
"Ionosphere and magnetosphere dynamics",0.647934637602771,1.80290178145141,-0.937250730463402
"IoT and Edge/Fog Computing",1.35911874395598,1.92389550797208,0.628323104046399
"IoT and GPS-based Vehicle Safety Systems",0.586223748237639,1.50291844772729,0.45998429416156
"IoT Networks and Protocols",1.15161446516682,2.26299705984524,0.249558705558144
"IoT-based Control Systems",0.158921654528317,1.42353042502844,0.450296131344254
"IoT-based Smart Home Systems",0.87413211664553,1.76907850668204,0.453934998083887
"IPv6, Mobility, Handover, Networks, Security",0.84447249243382,1.34721335254568,0.750498464304685
"Irish and British Studies",-0.262690872221098,-1.24838646714702,2.79637656960588
"Iron and Steelmaking Processes",-0.728312770694278,1.99113556642599,-1.54804349752298
"Iron Metabolism and Disorders",0.641444369558048,-1.01258641603543,-1.97823993909252
"Iron oxide chemistry and applications",-0.593568538576593,1.84804089362712,-1.8030626782554
"Iron-based superconductors research",0.378326170204472,2.29463074599242,-2.10415311784883
"Irrigation Practices and Water Management",-1.85340749141155,0.594425873531399,-1.71635590538411
"Islamic Finance and Banking Studies",-1.46400502501706,0.508612633033508,1.5777062415763
"Islamic Finance and Communication",-1.61722110115334,0.569469103541511,1.45213536539775
"Islamic Social Reporting",-0.390955042212827,-0.122487537261861,0.481140305705248
"Islamic Studies and History",-1.22573341708301,-0.103421126029933,1.85415065753643
"Islamic Studies and Radicalism",-1.80833484101843,0.333552195421259,1.3938379971493
"Islamic Thought and Society Studies",-1.16391476558752,-0.129278541572407,1.6151459279224
"Island Studies and Pacific Affairs",-0.509255370464809,-0.079967058074085,2.38984851325099
"Islanding Detection in Power Systems",0.223205111902604,2.33947052671791,0.404508870025938
"Isotope Analysis in Ecology",-1.46433402309154,0.345271092436591,-0.993637235425712
"Italian Fascism and Post-war Society",-0.507005980711175,-0.811882007369463,2.44289120420793
"Italian Literature and Culture",-0.644149579920223,-0.521306361506414,2.39099183435139
"Italian Social Issues and Migration",-0.63646484430931,-0.473034482217712,2.43006906978657
"Italy: Economic History and Contemporary Issues",0.266137072843489,0.620105228050158,2.5661482790158
"Iterative Learning Control Systems",0.590856839444197,2.09504443598708,-0.0923420859132857
"Iterative Methods for Nonlinear Equations",1.47207187199745,1.87604170083803,-0.605999959380638
"Japanese History and Culture",-0.38041205275244,-0.705854008180243,2.81402805731769
"Jewish and Middle Eastern Studies",-0.296157473532356,-0.333405594439446,2.51056610723619
"Jewish Identity and Society",-0.0914683000752766,-0.384588184386103,2.48466438353399
"Job Satisfaction and Organizational Behavior",1.11599864793534,-0.297861182072053,2.35497554375986
"Joseph Conrad and Literature",-0.180830937583805,-1.19649854820621,2.7542338308761
"Journalism and Media Studies",-1.35291948639299,-2.39787926506364,1.94290828721778
"Judicial and Constitutional Studies",-0.680393922948838,0.311638124916233,2.63894883941576
"Jungian Analytical Psychology",-0.0136824596723822,-1.01252532814311,1.59095952665387
"Jury Decision Making Processes",-0.642336174536197,0.36446223619091,2.54243230657016
"Kantian Philosophy and Modern Interpretations",-0.613895922751655,-0.94615858397574,1.7851240156798
"Karl Barth and Christian Theology",-0.944845091159936,-0.863273427250446,1.77026713888852
"Karst Systems and Hydrogeology",-1.5243721927825,1.17434656878111,-0.810078491167135
"Kawasaki Disease and Coronary Complications",1.04848601751082,-1.78435370180664,-1.70440886111499
"Kidney Stones and Urolithiasis Treatments",0.298851844969489,-1.28870487002157,-1.45937050158378
"Kierkegaardian Philosophy and Influence",-0.686418501304137,-1.24362057716336,1.70059428415058
"Knee injuries and reconstruction techniques",0.839976678626171,-1.81257193313027,-0.794541727181361
"Knowledge Management and Sharing",1.18834706178535,0.667263501772475,1.87610169229535
"Knowledge Management and Technology",0.527481898107854,0.905890891865498,0.942356124641708
"Knowledge Management in Higher Education",-0.837500558118885,-2.78296718053136,1.84684910361588
"Knowledge Societies in the 21st Century",-0.848532986628618,-2.75179807814353,1.93163331766162
"Korean Peninsula Historical and Political Studies",-0.328393675110731,-0.392647224425218,2.80199831472768
"Korean Urban and Social Studies",-0.497212372255778,-0.143028690258005,1.54758946057679
"Kruppel-like factors research",0.18405202413495,-1.48425427025657,-2.48209206886952
"Labor Law and Work Dynamics",-1.1669165044799,-2.08403789505376,1.8747151489901
"Labor Market and Education",-0.611567113948906,1.29365382218876,2.0162029131552
"Labor market dynamics and wage inequality",0.607612993275264,0.109439271693133,2.64366799119112
"Labor Movements and Unions",0.599242518349789,-0.103464219091047,2.66819817351145
"Labour Market and Migration",-0.128184373125413,0.508192337744221,2.13278201683972
"Land Rights and Reforms",-1.19556784822385,0.126798335835789,0.81131361849449
"Land Use and Ecosystem Services",-1.65964112106639,0.452746066608031,-0.372627349318337
"Land Use and Management",-0.839143538848997,1.09879171471391,1.77954891486227
"Landfill Environmental Impact Studies",-1.1316567496858,1.64623404494707,-1.19605233840758
"Landscape and Cultural Studies",-0.586672167742402,-0.260672186874043,1.66465256393777
"Landslides and related hazards",-1.56642236123419,1.37229535693188,-0.968396425977947
"Language Acquisition and Education",-1.62082510541791,0.286126589922075,1.44067282323462
"Language and cultural evolution",1.72959297231302,0.0862478109523228,1.68164966667511
"Language and Culture",-0.951070420770488,-0.200491482897585,2.06030878929452
"Language Development and Disorders",1.88196896152547,-0.169826216388003,1.52167452716936
"Language, Communication, and Linguistic Studies",-0.493529786153412,0.425637220647123,1.70073305311198
"Language, Discourse, Communication Strategies",1.89743708355352,-0.250265017854946,1.8133470719326
"Language, Linguistics, Cultural Analysis",-0.957911461186814,-0.934466849603723,2.6093916871011
"Language, Metaphor, and Cognition",1.88631813387777,-0.247391561317911,1.82070742715833
"Lanthanide and Transition Metal Complexes",0.270826061772052,1.372616215764,-2.56847295077095
"Laser and Thermal Forming Techniques",-0.193287932095516,2.24434689263909,-0.709017079984636
"Laser Applications in Dentistry and Medicine",0.0120154729330428,-1.77556826628335,-0.551665062034414
"Laser Design and Applications",0.656417976946159,2.33628876280341,-1.68036722411383
"Laser Material Processing Techniques",0.363681807246951,2.28382877924335,-1.26494767717773
"Laser-Ablation Synthesis of Nanoparticles",-0.0790930447624218,1.75030645571052,-2.00376580299672
"Laser-induced spectroscopy and plasma",0.702311391709293,2.08515975658647,-1.75244686126602
"Laser-Matter Interactions and Applications",0.769702796602026,2.37862023027716,-1.65450254571714
"Laser-Plasma Interactions and Diagnostics",0.722544074434442,2.17881813941871,-1.75821006191768
"Latin American and Latino Studies",-0.533287021665362,-1.32303235043395,2.78740500604618
"Latin American Cultural Politics",-1.11855112790016,-2.31067358479598,2.04932427388257
"Latin American history and culture",-1.08612545687909,-2.08107585674096,2.28021678654278
"Latin American Legal and Economic Studies",-0.906623511161036,-2.65295986556675,1.89272448254707
"Latin American Literature Analysis",-1.08501782224636,-2.00248915178494,2.24119443945816
"Latin American Literature Studies",-1.07148889852911,-2.03956907710213,2.24359688121388
"Latin American rural development",-1.0781441887881,-2.45078778506521,2.05590182943444
"Latin American social science",-1.06812640861921,-2.05523251591717,1.91818860447145
"Latin American socio-political dynamics",-1.17682071367325,-2.34346880659692,1.98048228820591
"Latin American Urban Studies",-1.19771960499049,-2.38855997027694,2.19266041205047
"Lattice Boltzmann Simulation Studies",-0.233056633566448,1.56806554839211,-0.754650011722437
"Law and Political Science",-0.656749415578199,0.285782615731894,2.56948759510534
"Law in Society and Culture",-0.419975209391201,-0.731480244786223,2.29804727474321
"Law, AI, and Intellectual Property",0.565808117207653,0.0862706878689537,1.56136561422229
"Law, Economics, and Judicial Systems",-0.0205343626548781,0.321980390484215,2.77022288839948
"Law, Ethics, and AI Impact",-0.941097521650289,-2.39559948768555,1.8177015522846
"Law, logistics, and international trade",-0.58276633514072,1.09409711206088,1.51629458790839
"Law, Rights, and Freedoms",-0.150841784810916,-0.19101795905766,2.23872096745633
"Layered Double Hydroxides Synthesis and Applications",-0.549098022146987,1.74284815672275,-1.8155846545189
"Leadership and Management in Organizations",0.92068531565375,0.0616991020163923,2.08787837797673
"Leadership, Behavior, and Decision-Making Studies",0.964650440882924,0.0547441022516599,2.01452162830918
"Leadership, Courage, and Heroism Studies",1.27346483305728,-0.696637665499256,1.94005140595526
"Leadership, Human Resources, Global Affairs",-0.0902279085891483,0.525178702297643,2.08702821652418
"Leaf Properties and Growth Measurement",-1.75294651149648,0.504157468477672,-1.67353395050353
"Learning Styles and Cognitive Differences",1.25117699007558,-0.268839972066516,1.74730542184178
"Leech Biology and Applications",-1.41264481351973,-0.647787084886237,-1.32688457853758
"Legal and Constitutional Studies",-0.105286071366401,0.27247956786553,2.72290513922998
"Legal and cultural studies analysis",-0.508862674579539,-1.08649390081738,2.01320844993869
"Legal and Labor Studies",-0.609664242216077,-0.401307871351974,2.5074219095339
"Legal and Policy Analysis in Indonesia",-1.61329950880413,0.205975545909631,1.02392996082362
"Legal and Policy Issues",-0.822283382875578,1.04600259799775,1.98572440712984
"Legal and Regulatory Analysis",-0.803160244546222,1.04381492567965,1.96008419168913
