"node","x","y","z"
"Photorefractive and Nonlinear Optics",0.606439639197449,2.39281700747567,-1.73050489207065
"Photosynthetic Processes and Mechanisms",-1.7643448886643,0.434295338209565,-2.06407238028814
"Photovoltaic System Optimization Techniques",-0.0535650668966798,1.9768411297121,0.059990897703947
"Photovoltaic Systems and Sustainability",-0.0153575984100899,1.70119179001862,0.964291539691185
"Physical Activity and Education Research",0.0888103828703214,0.607888255494177,0.495244887404823
"Physical Activity and Health",1.22513312742618,-0.933655498192474,0.204622454325388
"Physical Education and Gymnastics",-0.476108015153602,-2.04753900007801,0.93103174796897
"Physical Education and Pedagogy",1.20050656934495,-0.909538308025453,1.18305629672132
"Physical education and sports games research",-0.0684917759503779,-0.877618079811234,0.897356099788921
"Physical Education and Sports Studies",-0.518471268193408,-2.01566555432126,1.11984654024847
"Physical Education and Training Studies",0.386214348426943,-0.852543847707834,0.405721842861579
"Physical Unclonable Functions (PUFs) and Hardware Security",1.64273424160685,2.09774635737509,0.623143962276755
"Physics and Engineering Research Articles",-0.0225291980228207,0.143762894117596,0.908066399806116
"Physics of Superconductivity and Magnetism",0.542717246205079,2.31251994542638,-1.98125168912786
"Physiological and biochemical adaptations",-1.57270134974002,-0.178250535458796,-0.981067933744924
"Phytase and its Applications",-1.47211327289626,0.0541685743910087,-2.19613240069574
"Phytochemical and Pharmacological Studies",-1.30034970249619,-0.224444216890356,-2.55879700311696
"Phytochemical compounds biological activities",-1.0794150484523,-0.209279583616785,-2.86843601171875
"Phytochemical Studies and Bioactivities",-1.24506453683413,-0.182541625333709,-2.74944379803383
"Phytochemicals and Antioxidant Activities",-1.36471312063413,-0.10561350213176,-2.41210503059457
"Phytochemicals and Medicinal Plants",-1.21488633395973,-0.311239571086788,-2.60055693978425
"Phytochemistry and Bioactive Compounds",-1.24744567518009,-0.202506152361262,-2.73465089702499
"Phytochemistry and Bioactivity Studies",-1.09747985940519,-0.223032180588637,-2.82044620929583
"Phytochemistry and Biological Activities",-1.22467202266177,-0.238153429244625,-2.78165763569746
"Phytochemistry and biological activities of Ficus species",-1.36582732143966,-0.223184356093986,-2.57886528470334
"Phytochemistry and biological activity of medicinal plants",-1.09250002900638,-0.425107952765577,-2.78610956055102
"Phytochemistry Medicinal Plant Applications",-1.4733748002031,-0.165663928552354,-2.16980652572741
"Phytoestrogen effects and research",-1.30897825560698,-0.09951206914218,-2.28649557652952
"Phytoplasmas and Hemiptera pathogens",-1.93901208760069,-0.351909397251903,-1.91686045898821
"PI3K/AKT/mTOR signaling in cancer",0.0653454510089294,-1.8341339111119,-2.49630127300726
"Pickering emulsions and particle stabilization",-0.10895772965535,1.60200132418673,-1.83903766199103
"Piezoelectric Actuators and Control",0.363748950162928,2.18610912349055,-0.551569867542066
"Pigment Synthesis and Properties",-0.110322459473948,2.02612104686666,-2.00866929747563
"Pineapple and bromelain studies",-1.57627159245562,-0.101687332712554,-2.10576019429613
"Piperaceae Chemical and Biological Studies",-1.11527393547002,-0.305185077305039,-2.71227749646181
"Pituitary Gland Disorders and Treatments",0.53229424752861,-1.71348824679022,-1.77514393089508
"Place Attachment and Urban Studies",-0.683374631432051,-0.176728282994208,1.67000940351727
"Planarian Biology and Electrostimulation",-0.759876355831394,-0.134610836099734,-1.60412384895319
"Planetary Science and Exploration",0.655475280051841,1.18666526203703,-0.828153410947319
"Plant and animal studies",-2.01673069674559,-0.366185389299139,-1.59731655275524
"Plant and Biological Electrophysiology Studies",-1.46099820449459,0.399340538194231,-1.70321616839504
"Plant and fungal interactions",-1.82599332398709,0.0414077386332358,-1.91063831208442
"Plant and Fungal Interactions Research",-1.95415031865003,-0.0652320523675758,-2.14313230370094
"Plant and Fungal Species Descriptions",-2.09352929504997,-0.248717853954528,-1.71583620528241
"Plant and soil sciences",-2.09851646518841,-0.398759118933341,-1.35697215626081
"Plant biochemistry and biosynthesis",-1.62069834411836,0.235245863259844,-2.36956400462113
"Plant chemical constituents analysis",-1.01959301012187,-0.144446417649492,-2.86538548009176
"Plant Disease Management Techniques",-1.99021792022644,-0.0860917553124392,-2.12062330761477
"Plant Disease Resistance and Genetics",-2.02246777024858,-0.0658482249896387,-2.16195783893636
"Plant Diversity and Evolution",-2.11039096537887,-0.243308670469002,-1.74585541919289
"Plant Ecology and Soil Science",-1.86039335599831,0.455344922431814,-0.905704362100471
"Plant Ecology and Taxonomy Studies",-2.09704345174449,-0.193671912017391,-1.70506597955593
"Plant Gene Expression Analysis",-1.62268065256919,0.225586926924764,-2.29388548773645
"Plant Genetic and Mutation Studies",-1.71824513053344,0.143153824781394,-2.0166726793742
"Plant Growth and Agriculture Techniques",-1.86175566120393,0.18132477189384,-0.458026984088115
"Plant Growth Enhancement Techniques",-1.76485716902405,0.40342149948223,-1.8844466211567
"Plant Micronutrient Interactions and Effects",-1.89045144979311,0.476413759298356,-2.0723650580172
"Plant Molecular Biology Research",-1.8693756900168,0.414525776715449,-2.08596348067252
"Plant nutrient uptake and metabolism",-1.9446855219375,0.356224469760573,-2.1096928061569
"Plant Parasitism and Resistance",-2.04012378393116,-0.14244483909669,-1.92035079012731
"Plant Pathogenic Bacteria Studies",-1.94919711494047,-0.212256676441144,-2.14675431573704
"Plant Pathogens and Fungal Diseases",-2.05354611049319,-0.105754143472657,-2.21526088853291
"Plant Pathogens and Resistance",-2.03494035280631,-0.0809778691634059,-2.23229964302862
"Plant pathogens and resistance mechanisms",-1.96251261588423,-0.181033141014286,-2.21470619009006
"Plant Physiology and Cultivation Studies",-1.81598934799167,0.296853468264227,-2.10268986367985
"Plant Reproductive Biology",-1.86045158992438,0.359177092255544,-2.1550856129877
"Plant responses to elevated CO2",-1.91627480022664,0.53957036350167,-1.64155630495131
"Plant responses to water stress",-1.91888569524202,0.522506024024889,-1.93148573784029
"Plant Stress Responses and Tolerance",-1.88721678275181,0.55803266918845,-2.02306896300027
"Plant Surface Properties and Treatments",-1.75230723113008,0.600200821736597,-1.86061320659181
"Plant Taxonomy and Phylogenetics",-2.0541659272116,-0.103685650171926,-1.71301597811314
"Plant tissue culture and regeneration",-1.7934276296637,0.105853239648587,-2.06601307541184
"Plant Toxicity and Pharmacological Properties",-1.42542265251256,-0.17800954972917,-2.60740201834604
"Plant Virus Research Studies",-1.96577763719617,-0.121626038507684,-2.09517247059835
"Plant Water Relations and Carbon Dynamics",-1.92091927785213,0.610296993030408,-1.43007475293183
"Plant-based Medicinal Research",-1.02972658608857,-0.276047807483694,-2.85862125063151
"Plant-Derived Bioactive Compounds",-1.45054750746652,-0.050566635749858,-2.32605457259613
"Plant-derived Lignans Synthesis and Bioactivity",-1.15687536659102,-0.230400733248,-2.8180649388588
"Plant-Microbe Interactions and Immunity",-2.06756183446097,-0.0772786425593633,-2.19359675854024
"Plasma and Flow Control in Aerodynamics",0.00140571048324306,1.59932937889091,-0.594871161446017
"Plasma Applications and Diagnostics",0.689815961812361,2.09974408232605,-1.77043654827703
"Plasma Diagnostics and Applications",0.736867307951071,2.1461530456212,-1.79895657756298
"Plasmonic and Surface Plasmon Research",0.772848064646983,2.43502136480102,-1.72447630138685
"Platelet Disorders and Treatments",0.656856426499628,-1.70261296070757,-1.99980883283971
"Pleistocene-Era Hominins and Archaeology",-1.26162709889203,-0.370363749552957,-0.0277542229050265
"Pleural and Pulmonary Diseases",0.778730331000962,-2.03662690856046,-1.11926532087123
"Pluripotent Stem Cells Research",0.00568308379562604,-0.786348879819305,-1.76455044343615
"Pneumocystis jirovecii pneumonia detection and treatment",-0.411845646745896,-1.78908356208458,-1.71930131515728
"Pneumonia and Respiratory Infections",-0.416469919883906,-1.44388528507589,-1.54793118733146
"Pneumothorax, Barotrauma, Emphysema",0.854506838253611,-2.12846068458403,-1.04884234047738
"Poetry Analysis and Criticism",-0.0868122909664997,-1.33418912301225,2.75876422936749
"Point processes and geometric inequalities",1.76031500895285,1.74051898424777,-0.620726285129592
"Poisoning and overdose treatments",0.667140173979236,-0.904280023592385,-1.8148013754963
"Polar Research and Ecology",-1.32802885102453,0.456257907160378,-1.30236963341899
"Policing Practices and Perceptions",1.1510241354427,-1.32882706284559,1.99908645922134
"Policy Transfer and Learning",0.422651758502163,-0.0661726829182186,2.55609399920214
"Polish Historical and Cultural Studies",-0.994375682794447,-0.222849494155731,2.07076054866717
"Polish Law and Legal System",-0.607672847784206,0.464363054943136,2.2225294172226
"Polish Legal and Social Issues",-0.185189563364549,0.363311539033067,2.04762762147139
"Polish socio-economic development",-0.12947155129347,0.682543119008066,2.16467951945626
"Polish-Jewish Holocaust Memory Studies",-0.879637787516291,-0.258496703611457,2.134169221056
"Political and Economic history of UK and US",0.408309671567448,-0.137799486497054,2.66694916638509
"Political and Social Dynamics in Chile and Latin America",-1.08689149922581,-2.16296995781907,2.03222783921371
"Political and Social Issues",-1.11032464044831,-1.01630851952889,2.92252878616295
"Political Conflict and Governance",-0.408238520806705,-0.0577253350002439,2.72105023927891
"Political Developments and Conflicts",-0.164503064960396,-0.276745413138451,0.298882760195061
"Political Dynamics in Latin America",-1.18109917508004,-2.34281348486972,2.04310871184575
"Political Economy and Marxism",0.290885088739042,-0.0937086491485135,2.66938726196328
"Political Influence and Corporate Strategies",0.626189638828064,-0.0243734024969027,2.62745862010479
"Political Philosophy and Ethics",0.0879554605713808,-1.16467812145342,2.11201150883739
"Political Science Research and Education",0.291500990560739,-0.673822324671045,2.36037916468609
"Political Systems and Governance",-0.191224745545723,0.138534599484686,2.51215802688123
"Political Theology and Sovereignty",-0.429474646937682,-1.24948470966918,2.08931901494323
"Political Theory and Democracy",-1.20714044165024,-2.25534790081537,2.0821483784298
"Political theory and Gramsci",0.362955956659018,-0.530372877064126,2.49300814341628
"Political Theory and Influence",-0.391257935797193,-1.06585222596625,2.63962006520594
"Politics and Conflicts in Afghanistan, Pakistan, and Middle East",-0.156978626423822,-0.264551947075704,2.98359671248657
"Politics and Society in Latin America",-0.966706575625307,-2.15982115904067,1.90323004931935
"Politics, Economics, and Education Policy",0.391769902399824,0.514258126006617,2.55200255515827
"Polyamine Metabolism and Applications",-0.459020344610296,-0.0653553477514741,-2.18583253713965
"Polydiacetylene-based materials and applications",0.0228518654403144,1.28781401461514,-2.25856001380224
"Polymer composites and self-healing",-0.426876626912676,1.42951152839182,-1.7185761375527
"Polymer crystallization and properties",-0.51176078181307,1.41825608265125,-1.67073035120088
"Polymer Foaming and Composites",-0.473818683700396,1.50518406098795,-1.50075303192935
"Polymer Nanocomposite Synthesis and Irradiation",-0.164104366420375,1.74364663738264,-1.85932410625376
"Polymer Nanocomposites and Properties",-0.317388532788849,1.58585944857541,-1.69217007202736
"Polymer Science and Applications",-0.423718235689327,2.10239777665461,-0.885753705156388
"Polymer Science and PVC",-0.396361723532695,1.34149396565738,-1.70603066504351
"Polymer Surface Interaction Studies",-0.370007192112415,0.667703073085743,-1.88573661554309
"Polymer Synthesis and Characterization",-0.145785735331112,0.974078932118682,-2.55314773011722
"Polymer-Based Agricultural Enhancements",-1.6566932599196,0.665507727258382,-1.77822128863637
"Polynomial and algebraic computation",1.6079117695778,1.86554021410173,-0.284412435699774
"Polyomavirus and related diseases",0.240199914852853,-2.01881457299614,-2.1306149931263
"Polyoxometalates: Synthesis and Applications",-0.172840110359675,1.42202415029082,-2.5917809035703
"Polysaccharides and Plant Cell Walls",-1.40678702898163,0.0619749519178589,-2.24893874587525
"Polysaccharides Composition and Applications",-1.41343509893393,0.0683773074414138,-2.21563860142283
"Pomegranate: compositions and health benefits",-1.45239820666751,-0.215233442587219,-2.4238940885352
"Populism, Right-Wing Movements",0.397636638484668,-0.17901060962665,2.68308824992704
"Porphyrin and Phthalocyanine Chemistry",0.236883090689231,1.45569622243892,-2.53807298247389
"Porphyrin Metabolism and Disorders",0.627913203373718,-0.857370225344749,-2.03576485515315
"Post-Communist Economic and Political Transition",-0.368619571635381,0.63536619592544,2.24213416338852
"Post-Soviet Geopolitical Dynamics",-0.810325616687562,0.334036970130846,2.11722861776469
"Postcolonial and Cultural Literary Studies",-0.297953445022604,-0.932346744693984,2.86089741535829
"Postharvest Quality and Shelf Life Management",-1.68319679286581,0.228638371561329,-2.22430293441312
"Posthumanist Ethics and Activism",0.252568319906974,-0.875195914707796,2.01579204369333
"Postmodernism in Literature and Education",-0.401442979656572,-0.914924497811583,1.44390312150056
"Posttraumatic Stress Disorder Research",1.38890532053895,-1.37936358273593,1.14765322354616
"Potassium and Related Disorders",0.936212218926624,-1.26482131096178,-1.93696018900716
"Potato Plant Research",-1.93183742501873,0.0926539443216271,-2.28951487622145
"Poverty, Education, and Child Welfare",0.621504794483222,-0.191408344160581,2.35495802286813
"Powder Metallurgy Techniques and Materials",-0.391828469253909,2.24673009125549,-0.947246712454341
"Powdery Mildew Fungal Diseases",-1.77853355302912,-0.224825089320113,-2.37618106549461
"Power Line Communications and Noise",1.04589362025411,2.52960289700042,0.06132353441416
"Power Line Inspection Robots",0.231245436394337,2.03732283706591,0.158892481967531
"Power Quality and Harmonics",0.243129572908143,2.37333446564195,0.0633014925883124
"Power System Optimization and Stability",0.253971949462965,2.30269737945986,0.448044874166304
"Power System Reliability and Maintenance",0.178774946399722,2.35396079772466,0.425511243563889
"Power Systems and Renewable Energy",0.203095648639316,2.27336230469217,0.509757249752015
"Power Systems and Technologies",0.234830285199545,2.25659799497604,0.480346011489399
"Power Systems Fault Detection",0.221267639708624,2.323448214458,0.378121051385159
"Power Transformer Diagnostics and Insulation",0.101895854481634,2.44037465571486,-0.122965836316343
"Poxvirus research and outbreaks",-0.816303793110489,-1.13709825173898,-1.73494335012196
"Pragmatism in Philosophy and Education",0.0371465492324002,-0.957327495161015,1.69913445677097
"Precipitation Measurement and Analysis",-1.34611004845807,1.20581222471828,-0.597681029390816
"Pregnancy and Medication Impact",0.686300901171137,-1.39282039731253,-1.46399652553787
"Pregnancy and preeclampsia studies",0.643608713754648,-1.40077071911079,-1.08763728965967
"Pregnancy-related medical research",0.518473591172094,-1.3302598056894,-0.788542382116384
"Prenatal Screening and Diagnostics",0.542970432942937,-1.43570583638016,-0.878535725511032
"Prenatal Substance Exposure Effects",0.954180791942613,-1.04083810332865,-1.13473740813186
"Pressure Ulcer Prevention and Management",0.316765744093242,-1.42083430174508,-0.961854559596823
"Preterm Birth and Chorioamnionitis",0.503409486292243,-1.37052822772668,-0.770340825926841
"Primary Care and Health Outcomes",1.06128958367853,-1.33557270183656,0.428605343393096
"Primate Behavior and Ecology",-1.66210535481752,-0.297058340653191,-0.869417829119267
"Prion Diseases and Protein Misfolding",1.12034807933797,-0.750313070924469,-1.69263111572698
"Privacy-Preserving Technologies in Data",1.52062925889645,1.79098286359259,0.73652351897444
"Privacy, Security, and Data Protection",1.4701736392623,1.54441797544305,0.927821844939234
"Private Equity and Venture Capital",0.513552913522796,0.855781950971259,2.48839694004309
"Probabilistic and Robust Engineering Design",0.43833879716611,1.53114263448722,-0.14510041903329
"Probabilistic Statistics in Medicine",-0.247774818195856,-0.255363647677728,0.38099033316526
"Probability and Risk Models",0.830269178549471,1.33049515590636,2.12751263373752
"Probability and Statistical Research",1.47515673478859,1.2532425971875,0.308634066577547
"Probiotics and Fermented Foods",-1.29143690191631,-0.0259871387755304,-2.18506402556775
"Problem and Project Based Learning",1.20483670723619,-0.0817868797326528,1.40975304108027
"Problem Solving Skills Development",1.16971363761312,-0.766936827736308,1.52933197884134
"Process Optimization and Integration",0.0407097464344016,1.48753976786276,-1.4918585020293
"Product Development and Customization",0.790303819513913,1.05796858371972,1.62990855817773
"Professional Masters Programs Analysis",0.13004845296701,-0.345739501243593,1.18017866395076
"Property Rights and Legal Doctrine",-0.340679582306061,0.289403209464153,2.47652229249911
"Prostate Cancer Diagnosis and Treatment",0.045661429657472,-1.53754150367579,-1.76228355515162
"Prostate Cancer Treatment and Research",0.0792957607550927,-1.46370550109493,-1.93680977899742
"Prosthetics and Rehabilitation Robotics",1.19267539453076,-0.446421108659094,-0.304639917507417
"Protease and Inhibitor Mechanisms",0.270379625870779,-1.37469180226585,-2.41090865628795
"Protein Degradation and Inhibitors",0.0105746284973507,-1.08592459916162,-2.65817804271596
"Protein Hydrolysis and Bioactive Peptides",-1.21966050859148,-0.0472533180488322,-2.08886722151872
"Protein Interaction Studies and Fluorescence Analysis",0.139439990988089,-0.309103859493205,-2.26211029835508
"Protein Kinase Regulation and GTPase Signaling",0.198159005793894,-0.955796556368227,-2.50719451368272
"Protein purification and stability",-0.427655763228781,-0.439507994655114,-2.17025035623256
"Protein Structure and Dynamics",0.276976242793778,0.530423871412217,-2.10528734272662
"Protein Tyrosine Phosphatases",0.143926075015851,-1.14728914414189,-2.4585392921999
"Proteins in Food Systems",-1.33201425421005,0.0588240143969118,-2.15682174340306
"Proteoglycans and glycosaminoglycans research",-0.183889957785267,-0.61597611256861,-2.37709083756013
"Protist diversity and phylogeny",-1.30570072155088,0.341415205849358,-1.40534509212029
"Psidium guajava Extracts and Applications",-1.33311153573897,-0.300602362846959,-2.45977247137793
"Psoriasis: Treatment and Pathogenesis",0.17561798573686,-1.57076167193162,-1.83140958790931
"Psychedelics and Drug Studies",0.495953435491428,-0.470140006717478,-1.87805407898652
"Psychiatric care and mental health services",1.16597975955244,-1.33687279839309,0.858670603693725
"Psychiatry, Mental Health, Neuroscience",0.110344032585935,-0.617475504566114,1.00810410364876
"Psychoanalysis and Psychopathology Research",-1.13514727395251,-1.11174029616355,2.88716438300156
"Psychoanalysis and Social Critique",0.232820538980429,-0.964212450071515,1.29698599427355
"Psychoanalysis, Philosophy, and Politics",-0.54854860424552,-1.21153842007402,1.84474659565216
"Psychodrama and Leishmaniasis Studies",0.403726175153723,-1.36223347467172,1.09924909783641
"Psycholinguistics and Behavioral Studies",-0.511517748079593,0.542386119560606,1.60560389825362
"Psychological and Educational Research Studies",1.51667435724861,-0.644352098768681,1.39649249580825
"Psychological and Temporal Perspectives Research",1.55200410309349,-0.922212093444249,1.22966271656379
"Psychological Testing and Assessment",1.1775948182269,-1.09972864920357,1.3419713316159
"Psychological Treatments and Assessments",1.30011715755994,-1.0185921216686,1.38769786458437
"Psychological Treatments and Disorders",-0.48118757531446,-2.3264025573918,1.64891023137432
"Psychological Well-being and Life Satisfaction",1.52455631385039,-1.10451392813432,1.15463678790727
"Psychology and Mental Health",-0.232256947414743,-2.25383359000603,0.856064019997599
"Psychology of Development and Education",-0.182728542850802,0.720718128745335,1.60930833390874
"Psychology of Moral and Emotional Judgment",1.22164951228563,-0.73523473250551,2.25791206570079
"Psychology of Social Influence",1.16938432399463,-0.75182438489489,2.36361394208315
"Psychology Research and Bibliometrics",-0.625861498958195,-2.50395057897716,1.663624935115
"Psychology, Coaching, and Therapy",0.436699244376987,-0.616775693718314,0.957716628805308
"Psychometric Methodologies and Testing",0.966418279291199,-0.298507197799127,0.693986736145483
"Psychopathy, Forensic Psychiatry, Sexual Offending",1.29908677785216,-1.36990610951919,1.8547587695534
"Psychosocial Factors Impacting Youth",1.51656503939742,-0.600519413062913,0.865414954264585
"Psychosomatic Disorders and Their Treatments",1.51586762964446,-1.28251315593854,0.391231857808774
"Psychotherapy Techniques and Applications",1.14413993595576,-1.23629062652253,1.28167408764481
"Public Administration and Governance",-0.900417971594816,0.0808218874260317,1.70763225135832
"Public Administration and Political Analysis",-0.273456458189782,-0.237238935302596,0.410811898796512
"Public Administration in Developing Nations",-1.62416201370385,0.476437016400206,1.2102390350334
"Public Administration, ICT, and Policy Development",0.262227535884699,0.437225727496285,1.8474838360442
"Public Health and Environmental Issues",-0.967871584841646,-2.6092094409276,1.86817893449566
"Public Health and Nutrition",-1.31958694164266,0.584734355585995,1.16264176176294
"Public health and occupational medicine",-0.3269194544058,-0.299808133195393,0.327656120509867
"Public Health and Social Inequalities",-0.645913252539686,-2.47078320951542,1.6294980702945
"Public Health in Brazil",-0.320601475032846,-2.19470927813577,0.734343464518035
"Public Health Policies and Education",0.747863139660295,-1.33420211726654,0.335440627423532
"Public Policy and Administration Research",0.697834506775842,0.395991904712107,2.50612987826251
"Public Policy and Governance",-1.13928634885639,-2.39310807725145,1.96799963055832
"Public Procurement and Policy",0.496673087926817,0.591322042287908,2.42479823351885
"Public Relations and Crisis Communication",1.10934769233538,0.264822314969388,2.1135472070554
"Public Spaces through Art",-0.567246935431291,-0.783982208491838,1.87273164831596
"Public-Private Partnership Projects",0.445981107238991,0.584509461060966,2.40056415134011
"Publishing and Scholarly Communication",0.75044764180621,-0.143714262230465,1.60324002730125
"Pulmonary Hypertension Research and Treatments",0.953058628334725,-1.77190180580995,-1.66995417603374
"Pulsars and Gravitational Waves Research",1.02230305070907,1.74140566838882,-1.14002934893915
"Pulsed Power Technology Applications",0.756421988968914,2.21778244726113,-1.78832907087934
"Q Methodology Applications",-1.5531554102093,0.357726322578816,-0.169838519713414
"QR Code Applications and Technologies",1.10189966006487,1.42300072355779,0.44696728433942
"Qualitative Comparative Analysis Research",0.768332671065464,-0.152423597950597,2.00890167117031
"Qualitative research in health",-0.661250509932561,-1.66780736568154,1.14859399064628
"Qualitative Research Methods and Applications",0.550393613625236,-0.414700399421343,1.90166932751522
"Qualitative Research Methods and Ethics",0.53624420238161,-0.657850481742565,1.96887581440474
"Quality and Management Systems",0.676675252497438,1.21804312784345,1.7188302037416
"Quality and Safety in Healthcare",0.978514417445206,0.755341498203561,0.762299831744463
"Quality and Supply Management",0.76586746022171,1.18545035991811,1.85272737848026
"Quality Function Deployment in Product Design",0.499164314880913,1.08579902228467,1.36611070551342
"Quality of Life Measurement",-0.149364062243564,0.804757988104361,2.1274474493951
"Quantum and Classical Electrodynamics",0.912683548202514,1.77576587509953,-1.25754420535438
"Quantum and electron transport phenomena",0.656572299693476,2.38417414930624,-1.86021458019759
"Quantum chaos and dynamical systems",1.39438672323069,2.00524466460001,-1.08205907495828
"Quantum Chromodynamics and Particle Interactions",1.0582346185787,1.96709035624176,-1.69346484617339
"Quantum Computing Algorithms and Architecture",1.12006646206131,2.36400844454991,-1.38116998581575
"Quantum Dots Synthesis And Properties",0.263303204179013,2.24887684392311,-2.30620912108144
"Quantum Electrodynamics and Casimir Effect",1.06050602059794,1.74671734147316,-1.25851326847868
"Quantum Information and Cryptography",1.06142445278744,2.39185690698967,-1.47019860982059
"Quantum many-body systems",1.02837110726794,2.27584497504217,-1.65510909021609
"Quantum Mechanics and Applications",1.15624851471236,2.31476236676826,-1.42621611894715
"Quantum Mechanics and Non-Hermitian Physics",1.31598488364693,2.10903823289313,-1.25118449949276
"Quantum optics and atomic interactions",0.900375016929174,2.32522550912164,-1.61072372468172
"Quantum-Dot Cellular Automata",1.15715397368818,2.45410828066505,-1.00512811567304
"Quantum, superfluid, helium dynamics",0.945975521390942,2.07715414708932,-1.78412694656919
"Quasicrystal Structures and Properties",0.117213565163522,2.23461534887342,-1.67180418772518
"Quinazolinone synthesis and applications",-0.1491705023205,0.57030116097832,-3.17600045193558
"Qur’anic Interpretation Studies",-1.73439662335675,0.247648986768569,1.46766151576904
"Rabbits: Nutrition, Reproduction, Health",-1.41235565725538,-0.196933146013439,-1.83941713776564
